technique_id,name,description,tactics_str,platforms,entity_count,group_count,software_count,frequency_category,total_score,all_entities,groups,software,detection_available,detection_notes,NIDS_Classification,NIDS_Reasoning,Network_Artifact
T1055.012,Process Hollowing,"Adversaries may inject malicious code into suspended and hollowed processes in order to evade process-based defenses. Process hollowing is a method of executing arbitrary code in the address space of a separate live process.  

Process hollowing is commonly performed by creating a process in a suspe...","defense-evasion, privilege-escalation",Windows,2,0,2,Medium,36.6,"QakBot, TrickBot",,"QakBot, TrickBot",False,,NO,Primarily local host-based operations,
T1132.001,Standard Encoding,Adversaries may encode data with a standard data encoding system to make the content of command and control traffic more difficult to detect. Command and control (C2) information can be encoded using a standard data encoding system that adheres to existing protocol specifications. Common data encodi...,command-and-control,"ESXi, Linux, Windows, macOS",4,1,3,Common,36.4,"Carbanak, Lazarus Group, QakBot, TrickBot",Lazarus Group,"Carbanak, QakBot, TrickBot",False,,PARTIAL,May involve network communication based on implementation,Protocol-specific traffic if network variant used
T1569.002,Service Execution,Adversaries may abuse the Windows service control manager to execute malicious commands or payloads. The Windows service control manager (<code>services.exe</code>) is an interface to manage and manipulate services.(Citation: Microsoft Service Control Manager) The service control manager is accessib...,execution,Windows,3,3,0,Medium,36.4,"APT38, Silence, Wizard Spider","APT38, Silence, Wizard Spider",,False,,NO,Primarily local host-based operations,
T1203,Exploitation for Client Execution,Adversaries may exploit software vulnerabilities in client applications to execute code. Vulnerabilities can exist in software due to unsecure coding practices that can lead to unanticipated behavior. Adversaries can take advantage of certain vulnerabilities through targeted exploitation for the pur...,execution,"Linux, macOS, Windows",3,3,0,Medium,36.4,"Andariel, Cobalt Group, Lazarus Group","Andariel, Cobalt Group, Lazarus Group",,False,,NO,Primarily local host-based operations,
T1134.002,Create Process with Token,Adversaries may create a new process with an existing token to escalate privileges and bypass access controls. Processes can be created with the token and resulting security context of another user using features such as <code>CreateProcessWithTokenW</code> and <code>runas</code>.(Citation: Microsof...,"defense-evasion, privilege-escalation",Windows,1,1,0,Rare,35.6,Lazarus Group,Lazarus Group,,False,,NO,Primarily local host-based operations,
T1484.001,Group Policy Modification,"Adversaries may modify Group Policy Objects (GPOs) to subvert the intended discretionary access controls for a domain, usually with the intention of escalating privileges on the domain. Group policy allows for centralized management of user and computer settings in Active Directory (AD). GPOs are co...","defense-evasion, privilege-escalation",Windows,1,1,0,Rare,35.6,Indrik Spider,Indrik Spider,,False,,NO,Primarily local host-based operations,
T1136.001,Local Account,"Adversaries may create a local account to maintain access to victim systems. Local accounts are those configured by an organization for use by users, remote support, services, or for administration on a single system or service. 

For example, with a sufficient level of access, the Windows <code>net...",persistence,"Linux, macOS, Windows, Network Devices, Containers, ESXi",3,2,1,Medium,35.4,"Carbanak, Indrik Spider, Wizard Spider","Indrik Spider, Wizard Spider",Carbanak,False,,NO,Primarily local host-based operations,
T1571,Non-Standard Port,"Adversaries may communicate using a protocol and port pairing that are typically not associated. For example, HTTPS over port 8088(Citation: Symantec Elfin Mar 2019) or port 587(Citation: Fortinet Agent Tesla April 2018) as opposed to the traditional port 443. Adversaries may make changes to the sta...",command-and-control,"ESXi, Linux, macOS, Windows",3,2,1,Medium,35.4,"Lazarus Group, Silence, TrickBot","Lazarus Group, Silence",TrickBot,False,,YES,Non-standard ports for C2,"Known protocols on unusual ports, custom protocols"
T1489,Service Stop,Adversaries may stop or disable services on a system to render those services unavailable to legitimate users. Stopping critical services or processes can inhibit or stop response to an incident or aid in the adversary's overall objectives to cause damage to the environment.(Citation: Talos Olympic ...,impact,"ESXi, IaaS, Linux, macOS, Windows",3,3,0,Medium,35.2,"Indrik Spider, Lazarus Group, Wizard Spider","Indrik Spider, Lazarus Group, Wizard Spider",,False,,NO,Primarily local host-based operations,
T1197,BITS Jobs,"Adversaries may abuse BITS jobs to persistently execute code and perform various background tasks. Windows Background Intelligent Transfer Service (BITS) is a low-bandwidth, asynchronous file transfer mechanism exposed through [Component Object Model](https://attack.mitre.org/techniques/T1559/001) (...","defense-evasion, persistence",Windows,1,1,0,Rare,35.2,Wizard Spider,Wizard Spider,,False,,NO,Primarily local host-based operations,
T1486,Data Encrypted for Impact,Adversaries may encrypt data on target systems or on large numbers of systems in a network to interrupt availability to system and network resources. They can attempt to render stored data inaccessible by encrypting files or data on local and remote drives and withholding access to a decryption key....,impact,"ESXi, IaaS, Linux, macOS, Windows",3,3,0,Medium,35.2,"APT38, Indrik Spider, TA505","APT38, Indrik Spider, TA505",,False,,NO,Primarily local host-based operations,
T1552.001,Credentials In Files,"Adversaries may search local file systems and remote file shares for files containing insecurely stored credentials. These can be files created by users to store their own credentials, shared credential stores for a group of individuals, configuration files containing passwords for a system or servi...",credential-access,"Containers, IaaS, Linux, macOS, Windows",3,2,1,Medium,34.8,"Indrik Spider, TA505, TrickBot","Indrik Spider, TA505",TrickBot,False,,NO,Primarily local host-based operations,
T1585.002,Email Accounts,"Adversaries may create email accounts that can be used during targeting. Adversaries can use accounts created with email providers to further their operations, such as leveraging them to conduct [Phishing for Information](https://attack.mitre.org/techniques/T1598) or [Phishing](https://attack.mitre....",resource-development,PRE,3,3,0,Medium,34.6,"Indrik Spider, Lazarus Group, Wizard Spider","Indrik Spider, Lazarus Group, Wizard Spider",,False,,PARTIAL,May involve network communication based on implementation,Protocol-specific traffic if network variant used
T1583.001,Domains,"Adversaries may acquire domains that can be used during targeting. Domain names are the human readable names used to represent one or more IP addresses. They can be purchased or, in some cases, acquired for free.

Adversaries may use acquired domains for a variety of purposes, including for [Phishin...",resource-development,PRE,3,3,0,Medium,34.6,"APT38, Lazarus Group, TA505","APT38, Lazarus Group, TA505",,False,,NO,Primarily local host-based operations,
T1497,Virtualization/Sandbox Evasion,"Adversaries may employ various means to detect and avoid virtualization and analysis environments. This may include changing behaviors based on the results of checks for the presence of artifacts indicative of a virtual machine environment (VME) or sandbox. If the adversary detects a VME, they may a...","defense-evasion, discovery","Linux, macOS, Windows",1,0,1,Rare,34.4,Carberp,,Carberp,False,,NO,Primarily local host-based operations,
T1021.004,SSH,"Adversaries may use [Valid Accounts](https://attack.mitre.org/techniques/T1078) to log into remote machines using Secure Shell (SSH). The adversary may then perform actions as the logged-on user.

SSH is a protocol that allows authorized users to open remote shells on other computers. Many Linux and...",lateral-movement,"ESXi, Linux, macOS",3,3,0,Medium,33.8,"GCMAN, Indrik Spider, Lazarus Group","GCMAN, Indrik Spider, Lazarus Group",,False,,YES,SSH remote access,"SSH traffic on port 22, encrypted sessions"
T1518,Software Discovery,"Adversaries may attempt to get a listing of software and software versions that are installed on a system or in a cloud environment. Adversaries may use the information from [Software Discovery](https://attack.mitre.org/techniques/T1518) during automated discovery to shape follow-on behaviors, inclu...",discovery,"ESXi, IaaS, Linux, macOS, Windows",3,0,3,Medium,33.8,"Dridex, Dyre, QakBot",,"Dridex, Dyre, QakBot",False,,PARTIAL,May involve network communication based on implementation,Protocol-specific traffic if network variant used
T1087.003,Email Account,"Adversaries may attempt to get a listing of email addresses and accounts. Adversaries may try to dump Exchange address lists such as global address lists (GALs).(Citation: Microsoft Exchange Address Lists)

In on-premises Exchange and Exchange Online, the <code>Get-GlobalAddressList</code> PowerShel...",discovery,"Windows, Office Suite",2,1,1,Medium,32.8,"TA505, TrickBot",TA505,TrickBot,False,,NO,Primarily local host-based operations,
T1010,Application Window Discovery,"Adversaries may attempt to get a listing of open application windows. Window listings could convey information about how the system is used.(Citation: Prevailion DarkWatchman 2021) For example, information about application windows could be used identify potential data to collect as well as identify...",discovery,"Linux, Windows, macOS",2,1,1,Medium,32.8,"Lazarus Group, QakBot",Lazarus Group,QakBot,False,,NO,Primarily local host-based operations,
T1069,Permission Groups Discovery,"Adversaries may attempt to discover group and permission settings. This information can help adversaries determine which user accounts and groups are available, the membership of users in particular groups, and which users and groups have elevated permissions.

Adversaries may attempt to discover gr...",discovery,"Containers, IaaS, Identity Provider, Linux, macOS, Office Suite, SaaS, Windows",2,1,1,Medium,32.8,"TA505, TrickBot",TA505,TrickBot,False,,NO,Primarily local host-based operations,
T1124,System Time Discovery,"An adversary may gather the system time and/or time zone settings from a local or remote system. The system time is set and stored by services, such as the Windows Time Service on Windows or <code>systemsetup</code> on macOS.(Citation: MSDN System Time)(Citation: Technet Windows Time Service)(Citati...",discovery,"ESXi, Linux, macOS, Network Devices, Windows",2,1,1,Medium,32.8,"Lazarus Group, QakBot",Lazarus Group,QakBot,False,,NO,Primarily local host-based operations,
T1189,Drive-by Compromise,"Adversaries may gain access to a system through a user visiting a website over the normal course of browsing. Multiple ways of delivering exploit code to a browser exist (i.e., [Drive-by Target](https://attack.mitre.org/techniques/T1608/004)), including:

* A legitimate website is compromised, allow...",initial-access,"Identity Provider, Linux, macOS, Windows",3,3,0,Medium,32.6,"APT38, Andariel, Lazarus Group","APT38, Andariel, Lazarus Group",,False,,PARTIAL,May involve network communication based on implementation,Protocol-specific traffic if network variant used
T1550.002,Pass the Hash,"Adversaries may “pass the hash” using stolen password hashes to move laterally within an environment, bypassing normal system access controls. Pass the hash (PtH) is a method of authenticating as a user without having access to the user's cleartext password. This method bypasses standard authenticat...","defense-evasion, lateral-movement",Windows,1,1,0,Rare,32.4,Wizard Spider,Wizard Spider,,False,,NO,Primarily local host-based operations,
T1055.002,Portable Executable Injection,"Adversaries may inject portable executables (PE) into processes in order to evade process-based defenses as well as possibly elevate privileges. PE injection is a method of executing arbitrary code in the address space of a separate live process. 

PE injection is commonly performed by copying code ...","defense-evasion, privilege-escalation",Windows,1,0,1,Rare,31.6,Carbanak,,Carbanak,False,,NO,Primarily local host-based operations,
T1055.004,Asynchronous Procedure Call,"Adversaries may inject malicious code into processes via the asynchronous procedure call (APC) queue in order to evade process-based defenses as well as possibly elevate privileges. APC injection is a method of executing arbitrary code in the address space of a separate live process. 

APC injection...","defense-evasion, privilege-escalation",Windows,1,0,1,Rare,31.6,Carberp,,Carberp,False,,NO,Primarily local host-based operations,
T1574.013,KernelCallbackTable,Adversaries may abuse the <code>KernelCallbackTable</code> of a process to hijack its execution flow in order to run their own payloads.(Citation: Lazarus APT January 2022)(Citation: FinFisher exposed ) The <code>KernelCallbackTable</code> can be found in the Process Environment Block (PEB) and is i...,"persistence, privilege-escalation, defense-evasion",Windows,1,1,0,Rare,30.87,Lazarus Group,Lazarus Group,,False,,NO,Primarily local host-based operations,
T1102.002,Bidirectional Communication,"Adversaries may use an existing, legitimate external Web service as a means for sending commands to and receiving output from a compromised system over the Web service channel. Compromised systems may leverage popular websites and social media to host command and control (C2) instructions. Those inf...",command-and-control,"Linux, macOS, Windows, ESXi",2,2,0,Medium,30.4,"Carbanak, Lazarus Group","Carbanak, Lazarus Group",,False,,PARTIAL,May involve network communication based on implementation,Protocol-specific traffic if network variant used
T1558.003,Kerberoasting,Adversaries may abuse a valid Kerberos ticket-granting ticket (TGT) or sniff network traffic to obtain a ticket-granting service (TGS) ticket that may be vulnerable to [Brute Force](https://attack.mitre.org/techniques/T1110).(Citation: Empire InvokeKerberoast Oct 2016)(Citation: AdSecurity Cracking ...,credential-access,Windows,2,2,0,Medium,29.8,"Indrik Spider, Wizard Spider","Indrik Spider, Wizard Spider",,False,,PARTIAL,May involve network communication based on implementation,Protocol-specific traffic if network variant used
T1185,Browser Session Hijacking,"Adversaries may take advantage of security vulnerabilities and inherent functionality in browser software to change content, modify user-behaviors, and intercept information as part of various browser session hijacking techniques.(Citation: Wikipedia Man in the Browser)

A specific example is when a...",collection,Windows,4,0,4,Common,29.4,"Carberp, Dridex, QakBot, TrickBot",,"Carberp, Dridex, QakBot, TrickBot",False,,NO,Primarily local host-based operations,
T1482,Domain Trust Discovery,Adversaries may attempt to gather information on domain trust relationships that may be used to identify lateral movement opportunities in Windows multi-domain/forest environments. Domain trusts provide a mechanism for a domain to allow access to resources based on the authentication procedures of a...,discovery,Windows,2,0,2,Medium,28.8,"QakBot, TrickBot",,"QakBot, TrickBot",False,,PARTIAL,May involve network communication based on implementation,Protocol-specific traffic if network variant used
T1557.001,LLMNR/NBT-NS Poisoning and SMB Relay,"By responding to LLMNR/NBT-NS network traffic, adversaries may spoof an authoritative source for name resolution to force communication with an adversary controlled system. This activity may be used to collect or relay authentication materials. 

Link-Local Multicast Name Resolution (LLMNR) and NetB...","credential-access, collection",Windows,2,2,0,Medium,28.6,"Lazarus Group, Wizard Spider","Lazarus Group, Wizard Spider",,False,,YES,LLMNR/NBT-NS poisoning,"Spoofed LLMNR/NBT-NS responses, name resolution anomalies"
T1113,Screen Capture,Adversaries may attempt to take screen captures of the desktop to gather information over the course of an operation. Screen capturing functionality may be included as a feature of a remote access tool used in post-compromise operations. Taking a screenshot is also typically possible through native ...,collection,"Linux, Windows, macOS",3,1,2,Medium,28.4,"Carbanak, Carberp, Silence",Silence,"Carbanak, Carberp",False,,PARTIAL,May involve network communication based on implementation,Protocol-specific traffic if network variant used
T1518.002,Backup Software Discovery,"Adversaries may attempt to get a listing of backup software or configurations that are installed on a system. Adversaries may use this information to shape follow-on behaviors, such as [Data Destruction](https://attack.mitre.org/techniques/T1485), [Inhibit System Recovery](https://attack.mitre.org/t...",discovery,"Windows, macOS, Linux",1,1,0,Rare,27.8,Wizard Spider,Wizard Spider,,False,,PARTIAL,May involve network communication based on implementation,Protocol-specific traffic if network variant used
T1217,Browser Information Discovery,"Adversaries may enumerate information about browsers to learn more about compromised environments. Data saved by browsers (such as bookmarks, accounts, and browsing history) may reveal a variety of personal information about users (e.g., banking sites, relationships/interests, social media, etc.) as...",discovery,"Linux, macOS, Windows",1,1,0,Rare,27.8,APT38,APT38,,False,,NO,Primarily local host-based operations,
T1614.001,System Language Discovery,"Adversaries may attempt to gather information about the system language of a victim in order to infer the geographical location of that host. This information may be used to shape follow-on behaviors, including whether the adversary infects the target and/or attempts specific actions. This decision ...",discovery,"Linux, macOS, Windows",1,1,0,Rare,27.8,Malteiro,Malteiro,,False,,NO,Primarily local host-based operations,
T1087.002,Domain Account,"Adversaries may attempt to get a listing of domain accounts. This information can help adversaries determine which domain accounts exist to aid in follow-on behavior such as targeting specific accounts which possess particular privileges.

Commands such as <code>net user /domain</code> and <code>net...",discovery,"Linux, macOS, Windows",1,1,0,Rare,27.8,Wizard Spider,Wizard Spider,,False,,NO,Primarily local host-based operations,
T1680,Local Storage Discovery,"Adversaries may enumerate local drives, disks, and/or volumes and their attributes like total or free space and volume serial number. This can be done to prepare for ransomware-related encryption, to perform [Lateral Movement](https://attack.mitre.org/tactics/TA0109), or as a precursor to [Direct Vo...",discovery,"ESXi, IaaS, Linux, macOS, Windows",1,1,0,Rare,27.8,Lazarus Group,Lazarus Group,,False,,PARTIAL,May involve network communication based on implementation,Protocol-specific traffic if network variant used
T1559.002,Dynamic Data Exchange,"Adversaries may use Windows Dynamic Data Exchange (DDE) to execute arbitrary commands. DDE is a client-server protocol for one-time and/or continuous inter-process communication (IPC) between applications. Once a link is established, applications can autonomously exchange transactions consisting of ...",execution,Windows,2,2,0,Medium,27.4,"Cobalt Group, TA505","Cobalt Group, TA505",,False,,PARTIAL,May involve network communication based on implementation,Protocol-specific traffic if network variant used
T1068,Exploitation for Privilege Escalation,"Adversaries may exploit software vulnerabilities in an attempt to elevate privileges. Exploitation of a software vulnerability occurs when an adversary takes advantage of a programming error in a program, service, or within the operating system software or kernel itself to execute adversary-controll...",privilege-escalation,"Containers, Linux, macOS, Windows",2,1,1,Medium,27.2,"Carberp, Cobalt Group",Cobalt Group,Carberp,False,,NO,Primarily local host-based operations,
T1572,Protocol Tunneling,Adversaries may tunnel network communications to and from a victim system within a separate protocol to avoid detection/network filtering and/or enable access to otherwise unreachable systems. Tunneling involves explicitly encapsulating a protocol within another. This behavior may conceal malicious ...,command-and-control,"ESXi, Linux, macOS, Windows",2,1,1,Medium,26.4,"Cobalt Group, QakBot",Cobalt Group,QakBot,False,,YES,Protocol tunneling for C2,"Encapsulated protocols, unusual port/protocol combinations"
T1573.002,Asymmetric Cryptography,"Adversaries may employ a known asymmetric encryption algorithm to conceal command and control traffic rather than relying on any inherent protections provided by a communication protocol. Asymmetric cryptography, also known as public key cryptography, uses a keypair per party: one public that can be...",command-and-control,"ESXi, Linux, macOS, Network Devices, Windows",2,1,1,Medium,26.4,"Cobalt Group, Dridex",Cobalt Group,Dridex,False,,PARTIAL,May involve network communication based on implementation,Protocol-specific traffic if network variant used
T1008,Fallback Channels,Adversaries may use fallback or alternate communication channels if the primary channel is compromised or inaccessible in order to maintain reliable command and control and to avoid data transfer thresholds.,command-and-control,"Linux, Windows, macOS, ESXi",2,1,1,Medium,26.4,"Lazarus Group, TrickBot",Lazarus Group,TrickBot,False,,PARTIAL,May involve network communication based on implementation,Protocol-specific traffic if network variant used
T1561.002,Disk Structure Wipe,"Adversaries may corrupt or wipe the disk data structures on a hard drive necessary to boot a system; targeting specific critical systems or in large numbers in a network to interrupt availability to system and network resources. 

Adversaries may attempt to render the system unable to boot by overwr...",impact,"Linux, macOS, Windows, Network Devices",2,2,0,Medium,26.2,"APT38, Lazarus Group","APT38, Lazarus Group",,False,,PARTIAL,May involve network communication based on implementation,Protocol-specific traffic if network variant used
T1485,Data Destruction,"Adversaries may destroy data and files on specific systems or in large numbers on a network to interrupt availability to systems, services, and network resources. Data destruction is likely to render stored data irrecoverable by forensic techniques through overwriting files or data on local and remo...",impact,"Containers, ESXi, IaaS, Linux, macOS, Windows",2,2,0,Medium,26.2,"APT38, Lazarus Group","APT38, Lazarus Group",,False,,NO,Primarily local host-based operations,
T1529,System Shutdown/Reboot,"Adversaries may shutdown/reboot systems to interrupt access to, or aid in the destruction of, those systems. Operating systems may contain commands to initiate a shutdown/reboot of a machine or network device. In some cases, these commands may also be used to initiate a shutdown/reboot of a remote c...",impact,"ESXi, Linux, macOS, Network Devices, Windows",2,2,0,Medium,26.2,"APT38, Lazarus Group","APT38, Lazarus Group",,False,,PARTIAL,May involve network communication based on implementation,Protocol-specific traffic if network variant used
T1210,Exploitation of Remote Services,"Adversaries may exploit remote services to gain unauthorized access to internal systems once inside of a network. Exploitation of a software vulnerability occurs when an adversary takes advantage of a programming error in a program, service, or within the operating system software or kernel itself t...",lateral-movement,"Linux, Windows, macOS, ESXi",3,1,2,Medium,25.8,"QakBot, TrickBot, Wizard Spider",Wizard Spider,"QakBot, TrickBot",False,,PARTIAL,May involve network communication based on implementation,Protocol-specific traffic if network variant used
T1110,Brute Force,"Adversaries may use brute force techniques to gain access to accounts when passwords are unknown or when password hashes are obtained.(Citation: TrendMicro Pawn Storm Dec 2020) Without knowledge of the password for an account or set of accounts, an adversary may systematically guess the password usi...",credential-access,"Containers, ESXi, IaaS, Identity Provider, Linux, macOS, Network Devices, Office Suite, SaaS, Windows",2,1,1,Medium,25.8,"APT38, QakBot",APT38,QakBot,False,,PARTIAL,Brute force can be local or remote,"Multiple failed auth attempts via SMB, RDP, SSH, LDAP"
T1555,Credentials from Password Stores,"Adversaries may search for common password storage locations to obtain user credentials.(Citation: F-Secure The Dukes) Passwords are stored in several places on a system, depending on the operating system or application holding the credentials. There are also specific applications and services that ...",credential-access,"IaaS, Linux, macOS, Windows",2,1,1,Medium,25.8,"Carberp, Malteiro",Malteiro,Carberp,False,,NO,Primarily local host-based operations,
T1021.005,VNC,Adversaries may use [Valid Accounts](https://attack.mitre.org/techniques/T1078) to remotely control machines using Virtual Network Computing (VNC).  VNC is a platform-independent desktop sharing system that uses the RFB (“remote framebuffer”) protocol to enable users to remotely control another comp...,lateral-movement,"Linux, Windows, macOS",3,1,2,Medium,25.8,"Carberp, GCMAN, TrickBot",GCMAN,"Carberp, TrickBot",False,,PARTIAL,May involve network communication based on implementation,Protocol-specific traffic if network variant used
