technique_id,name,description,tactics_str,platforms,entity_count,group_count,software_count,frequency_category,total_score,all_entities,groups,software,detection_available,detection_notes,NIDS_Classification,NIDS_Reasoning,Network_Artifact
T1005,Data from Local System,"Adversaries may search local system sources, such as file systems, configuration files, local databases, virtual machine files, or process memory, to find files of interest and sensitive data prior to Exfiltration.

Adversaries may do this using a [Command and Scripting Interpreter](https://attack.m...",collection,"ESXi, Linux, macOS, Network Devices, Windows",6,4,2,High-Priority,55.4,"APT38, Andariel, Lazarus Group, QakBot, TrickBot, Wizard Spider","APT38, Andariel, Lazarus Group, Wizard Spider","QakBot, TrickBot",False,,NO,Data collection from local filesystem,
T1016,System Network Configuration Discovery,"Adversaries may look for details about the network configuration and settings, such as IP and/or MAC addresses, of systems they access or through information discovery of remote systems. Several operating system administration utilities exist that can be used to gather this information. Examples inc...",discovery,"ESXi, Linux, macOS, Network Devices, Windows",5,2,3,Common,51.8,"Dyre, Lazarus Group, QakBot, TrickBot, Wizard Spider","Lazarus Group, Wizard Spider","Dyre, QakBot, TrickBot",False,,PARTIAL,"Network config discovery, usually local","DHCP requests, ARP queries if network enumeration occurs"
T1566.002,Spearphishing Link,Adversaries may send spearphishing emails with a malicious link in an attempt to gain access to victim systems. Spearphishing with a link is a specific variant of spearphishing. It is different from other forms of spearphishing in that it employs the use of links to download malware contained in ema...,initial-access,"Identity Provider, Linux, macOS, Office Suite, SaaS, Windows",6,4,2,High-Priority,51.6,"Cobalt Group, Lazarus Group, QakBot, TA505, TrickBot, Wizard Spider","Cobalt Group, Lazarus Group, TA505, Wizard Spider","QakBot, TrickBot",False,,YES,Email with malicious links,"SMTP traffic, HTTP redirects, DNS queries"
T1049,System Network Connections Discovery,"Adversaries may attempt to get a listing of network connections to or from the compromised system they are currently accessing or from remote systems by querying for information over the network. 

An adversary who gains access to a system that is part of a cloud-based environment may map out Virtua...",discovery,"Windows, IaaS, Linux, macOS, Network Devices, ESXi",4,3,1,Common,50.8,"APT38, Andariel, Lazarus Group, QakBot","APT38, Andariel, Lazarus Group",QakBot,False,,PARTIAL,"Network connection enumeration, local or remote","NetBIOS, SMB queries if remote, none if local commands"
T1204.001,Malicious Link,An adversary may rely upon a user clicking a malicious link in order to gain execution. Users may be subjected to social engineering to get them to click on a link that will lead to code execution. This user action will typically be observed as follow-on behavior from [Spearphishing Link](https://at...,execution,"Linux, macOS, Windows",5,4,1,Common,50.4,"APT38, Cobalt Group, QakBot, TA505, Wizard Spider","APT38, Cobalt Group, TA505, Wizard Spider",QakBot,False,,PARTIAL,Clicking malicious link triggers network,"HTTP requests to malicious URLs, redirects, downloads"
T1059.007,JavaScript,"Adversaries may abuse various implementations of JavaScript for execution. JavaScript (JS) is a platform-independent scripting language (compiled just-in-time at runtime) commonly associated with scripts in webpages, though JS can be executed in runtime environments outside the browser.(Citation: No...",execution,"Linux, macOS, Windows",5,4,1,Common,50.4,"Cobalt Group, Indrik Spider, QakBot, Silence, TA505","Cobalt Group, Indrik Spider, Silence, TA505",QakBot,False,,PARTIAL,"JavaScript execution, may fetch remote content",HTTP requests if script downloads additional payloads
T1620,Reflective Code Loading,"Adversaries may reflectively load code into a process in order to conceal the execution of malicious payloads. Reflective loading involves allocating then executing payloads directly within the memory of the process, vice creating a thread or process backed by a file path on disk (e.g., [Shared Modu...",defense-evasion,"Linux, macOS, Windows",1,1,0,Rare,49.0,Lazarus Group,Lazarus Group,,False,,NO,Reflective code loading in memory,
T1202,Indirect Command Execution,"Adversaries may abuse utilities that allow for command execution to bypass security restrictions that limit the use of command-line interpreters. Various Windows utilities may be used to execute commands, possibly without invoking [cmd](https://attack.mitre.org/software/S0106). For example, [Forfile...",defense-evasion,Windows,1,1,0,Rare,49.0,Lazarus Group,Lazarus Group,,False,,NO,Indirect command execution locally,
T1036.006,Space after Filename,"Adversaries can hide a program's true filetype by changing the extension of a file. With certain file types (specifically this does not work with .app extensions), appending a space to the end of a filename will change how the file is processed by the operating system.

For example, if there is a Ma...",defense-evasion,"Linux, macOS",1,1,0,Rare,49.0,APT38,APT38,,False,,NO,Filename manipulation is local,
T1220,XSL Script Processing,"Adversaries may bypass application control and obscure execution of code by embedding scripts inside XSL files. Extensible Stylesheet Language (XSL) files are commonly used to describe the processing and rendering of data within XML files. To support complex operations, the XSL standard includes sup...",defense-evasion,Windows,1,1,0,Rare,49.0,Cobalt Group,Cobalt Group,,False,,NO,XSL script processing locally,
T1027.003,Steganography,"Adversaries may use steganography techniques in order to prevent the detection of hidden information. Steganographic techniques can be used to hide data in digital media such as images, audio tracks, video clips, or text files.

[Duqu](https://attack.mitre.org/software/S0038) was an early example of...",defense-evasion,"Linux, macOS, Windows",1,1,0,Rare,49.0,Andariel,Andariel,,False,,NO,Steganography in local files,
T1027.007,Dynamic API Resolution,Adversaries may obfuscate then dynamically resolve API functions called by their malware in order to conceal malicious functionalities and impair defensive analysis. Malware commonly uses various [Native API](https://attack.mitre.org/techniques/T1106) functions provided by the OS to perform various ...,defense-evasion,Windows,1,1,0,Rare,49.0,Lazarus Group,Lazarus Group,,False,,NO,Dynamic API resolution in memory,
T1562.013,Disable or Modify Network Device Firewall,"Adversaries may disable network device-based firewall mechanisms entirely or add, delete, or modify particular rules in order to bypass controls limiting network usage. 
 
Modifying or disabling a network firewall may enable adversary C2 communications, lateral movement, and/or data exfiltration tha...",defense-evasion,Network Devices,1,1,0,Rare,49.0,APT38,APT38,,False,,PARTIAL,Network device firewall changes,"Changes visible in firewall logs, SNMP, config backups"
T1562.003,Impair Command History Logging,"Adversaries may impair command history logging to hide commands they run on a compromised system. Various command interpreters keep track of the commands users type in their terminal so that users can retrace what they've done. 

On Linux and macOS, command history is tracked in a file pointed to by...",defense-evasion,"ESXi, Linux, macOS, Network Devices, Windows",1,1,0,Rare,49.0,APT38,APT38,,False,,NO,Impairing command history locally,
T1070,Indicator Removal,Adversaries may delete or modify artifacts generated within systems to remove evidence of their presence or hinder defenses. Various artifacts may be created by an adversary or something that can be attributed to an adversary’s actions. Typically these artifacts are used as defensive indicators rela...,defense-evasion,"Containers, ESXi, Linux, macOS, Network Devices, Office Suite, Windows",1,1,0,Rare,49.0,Lazarus Group,Lazarus Group,,False,,NO,Indicator removal from local system,
T1218.008,Odbcconf,Adversaries may abuse odbcconf.exe to proxy execution of malicious payloads. Odbcconf.exe is a Windows utility that allows you to configure Open Database Connectivity (ODBC) drivers and data source names.(Citation: Microsoft odbcconf.exe) The Odbcconf.exe binary may be digitally signed by Microsoft....,defense-evasion,Windows,1,1,0,Rare,49.0,Cobalt Group,Cobalt Group,,False,,NO,Odbcconf local execution,
T1218,System Binary Proxy Execution,"Adversaries may bypass process and/or signature-based defenses by proxying execution of malicious content with signed, or otherwise trusted, binaries. Binaries used in this technique are often Microsoft-signed files, indicating that they have been either downloaded from Microsoft or are already nati...",defense-evasion,"Windows, Linux, macOS",1,1,0,Rare,49.0,Lazarus Group,Lazarus Group,,False,,NO,System binary proxy execution locally,
T1218.003,CMSTP,Adversaries may abuse CMSTP to proxy execution of malicious code. The Microsoft Connection Manager Profile Installer (CMSTP.exe) is a command-line program used to install Connection Manager service profiles. (Citation: Microsoft Connection Manager Oct 2009) CMSTP.exe accepts an installation informat...,defense-evasion,Windows,1,1,0,Rare,49.0,Cobalt Group,Cobalt Group,,False,,NO,CMSTP local execution,
T1027.009,Embedded Payloads,"Adversaries may embed payloads within other files to conceal malicious content from defenses. Otherwise seemingly benign files (such as scripts and executables) may be abused to carry and obfuscate malicious payloads and content. In some cases, embedded payloads may also enable adversaries to [Subve...",defense-evasion,"Linux, macOS, Windows",1,1,0,Rare,49.0,Lazarus Group,Lazarus Group,,False,,NO,Embedded payloads in local files,
T1070.003,Clear Command History,"In addition to clearing system logs, an adversary may clear the command history of a compromised account to conceal the actions undertaken during an intrusion. Various command interpreters keep track of the commands users type in their terminal so that users can retrace what they've done.

On Linux ...",defense-evasion,"ESXi, Linux, macOS, Network Devices, Windows",1,1,0,Rare,49.0,Lazarus Group,Lazarus Group,,False,,NO,Clearing command history locally,
T1222.001,Windows File and Directory Permissions Modification,Adversaries may modify file or directory permissions/attributes to evade access control lists (ACLs) and access protected files.(Citation: Hybrid Analysis Icacls1 June 2018)(Citation: Hybrid Analysis Icacls2 May 2018) File and directory permissions are commonly managed by ACLs configured by the file...,defense-evasion,Windows,1,1,0,Rare,49.0,Wizard Spider,Wizard Spider,,False,,NO,File permission changes locally,
T1480.002,Mutual Exclusion,"Adversaries may constrain execution or actions based on the presence of a mutex associated with malware. A mutex is a locking mechanism used to synchronize access to a resource. Only one thread or process can acquire a mutex at a given time.(Citation: Microsoft Mutexes)

While local mutexes only exi...",defense-evasion,"Linux, macOS, Windows",1,1,0,Rare,49.0,APT38,APT38,,False,,NO,Mutex checking in local memory,
T1012,Query Registry,"Adversaries may interact with the Windows Registry to gather information about the system, configuration, and installed software.

The Registry contains a significant amount of information about the operating system, configuration, software, and security.(Citation: Wikipedia Windows Registry) Inform...",discovery,Windows,4,2,2,Common,46.8,"Carbanak, Carberp, Indrik Spider, Lazarus Group","Indrik Spider, Lazarus Group","Carbanak, Carberp",False,,NO,Registry queries are local,
T1083,File and Directory Discovery,Adversaries may enumerate files and directories or may search in specific locations of a host or network share for certain information within a file system. Adversaries may use the information from [File and Directory Discovery](https://attack.mitre.org/techniques/T1083) during automated discovery t...,discovery,"ESXi, Linux, macOS, Network Devices, Windows",4,2,2,Common,46.8,"APT38, Lazarus Group, QakBot, TrickBot","APT38, Lazarus Group","QakBot, TrickBot",False,,NO,File and directory discovery locally,
T1135,Network Share Discovery,Adversaries may look for folders and drives shared on remote systems as a means of identifying sources of information to gather as a precursor for Collection and to identify potential systems of interest for Lateral Movement. Networks often contain shared network drives and folders that enable users...,discovery,"Linux, macOS, Windows",4,2,2,Common,46.8,"APT38, QakBot, TrickBot, Wizard Spider","APT38, Wizard Spider","QakBot, TrickBot",False,,PARTIAL,Network share discovery,"SMB/CIFS queries, NetBIOS enumeration traffic"
T1074.001,Local Data Staging,Adversaries may stage collected data in a central location or directory on the local system prior to Exfiltration. Data may be kept in separate files or combined into one file through techniques such as [Archive Collected Data](https://attack.mitre.org/techniques/T1560). Interactive command shells m...,collection,"ESXi, Linux, macOS, Windows",5,3,2,Common,46.4,"Dyre, Indrik Spider, Lazarus Group, QakBot, Wizard Spider","Indrik Spider, Lazarus Group, Wizard Spider","Dyre, QakBot",False,,NO,Local data staging in filesystem,
T1542.003,Bootkit,"Adversaries may use bootkits to persist on systems. A bootkit is a malware variant that modifies the boot sectors of a hard drive, allowing malicious code to execute before a computer's operating system has loaded. Bootkits reside at a layer below the operating system and may make it difficult to pe...","persistence, defense-evasion","Linux, Windows",3,1,2,Medium,45.2,"Carberp, Lazarus Group, TrickBot",Lazarus Group,"Carberp, TrickBot",False,,NO,Bootkit modifies local boot sectors,
T1036,Masquerading,"Adversaries may attempt to manipulate features of their artifacts to make them appear legitimate or benign to users and/or security tools. Masquerading occurs when the name or location of an object, legitimate or malicious, is manipulated or abused for the sake of evading defenses and observation. T...",defense-evasion,"Containers, ESXi, Linux, macOS, Windows",1,0,1,Rare,45.0,TrickBot,,TrickBot,False,,NO,Masquerading is local file operation,
T1014,Rootkit,"Adversaries may use rootkits to hide the presence of programs, files, network connections, services, drivers, and other system components. Rootkits are programs that hide the existence of malware by intercepting/hooking and modifying operating system API calls that supply system information. (Citati...",defense-evasion,"Linux, macOS, Windows",1,0,1,Rare,45.0,Carberp,,Carberp,False,,NO,Primarily local host-based operations,
T1027.011,Fileless Storage,"Adversaries may store data in ""fileless"" formats to conceal malicious activity from defenses. Fileless storage can be broadly defined as any format other than a file. Common examples of non-volatile fileless storage in Windows systems include the Windows Registry, event logs, or WMI repository.(Cita...",defense-evasion,"Windows, Linux",1,0,1,Rare,45.0,QakBot,,QakBot,False,,NO,Primarily local host-based operations,
T1036.008,Masquerade File Type,"Adversaries may masquerade malicious payloads as legitimate files through changes to the payload's formatting, including the file’s signature, extension, icon, and contents. Various file types have a typical standard format, including how they are encoded and organized. For example, a file’s signatu...",defense-evasion,"Linux, macOS, Windows",1,0,1,Rare,45.0,QakBot,,QakBot,False,,NO,Primarily local host-based operations,
T1027.006,HTML Smuggling,Adversaries may smuggle data and files past content filters by hiding malicious payloads inside of seemingly benign HTML files. HTML documents can store large binary objects known as JavaScript Blobs (immutable data that represents raw bytes) that can later be constructed into file-like objects. Dat...,defense-evasion,"Windows, Linux, macOS",1,0,1,Rare,45.0,QakBot,,QakBot,False,,NO,Primarily local host-based operations,
T1564.003,Hidden Window,"Adversaries may use hidden windows to conceal malicious activity from the plain sight of users. In some cases, windows that would typically be displayed when an application carries out an operation can be hidden. This may be utilized by system administrators to avoid disrupting user work environment...",defense-evasion,"Linux, macOS, Windows",1,0,1,Rare,45.0,TrickBot,,TrickBot,False,,NO,Primarily local host-based operations,
T1027.005,Indicator Removal from Tools,"Adversaries may remove indicators from tools if they believe their malicious tool was detected, quarantined, or otherwise curtailed. They can modify the tool by removing the indicator and using the updated version that is no longer detected by the target's defensive systems or subsequent targets tha...",defense-evasion,"Linux, macOS, Windows",1,0,1,Rare,45.0,QakBot,,QakBot,False,,NO,Primarily local host-based operations,
T1027.001,Binary Padding,"Adversaries may use binary padding to add junk data and change the on-disk representation of malware. This can be done without affecting the functionality or behavior of a binary, but can increase the size of the binary beyond what some security tools are capable of handling due to file size limitat...",defense-evasion,"Linux, Windows, macOS",1,0,1,Rare,45.0,QakBot,,QakBot,False,,NO,Primarily local host-based operations,
T1078.002,Domain Accounts,"Adversaries may obtain and abuse credentials of a domain account as a means of gaining Initial Access, Persistence, Privilege Escalation, or Defense Evasion.(Citation: TechNet Credential Theft) Domain accounts are those managed by Active Directory Domain Services where access and permissions are con...","defense-evasion, persistence, privilege-escalation, initial-access","ESXi, Linux, macOS, Windows",3,3,0,Medium,44.8,"Indrik Spider, TA505, Wizard Spider","Indrik Spider, TA505, Wizard Spider",,False,,NO,Primarily local host-based operations,
T1555.003,Credentials from Web Browsers,Adversaries may acquire credentials from web browsers by reading files specific to the target browser.(Citation: Talos Olympic Destroyer 2018) Web browsers commonly save credentials such as website usernames and passwords so that they do not need to be entered manually in the future. Web browsers ty...,credential-access,"Linux, macOS, Windows",5,2,3,Common,44.8,"Carberp, Malteiro, QakBot, TA505, TrickBot","Malteiro, TA505","Carberp, QakBot, TrickBot",False,,NO,Primarily local host-based operations,
T1548.002,Bypass User Account Control,"Adversaries may bypass UAC mechanisms to elevate process privileges on system. Windows User Account Control (UAC) allows a program to elevate its privileges (tracked as integrity levels ranging from low to high) to perform a task under administrator-level permissions, possibly by prompting the user ...","privilege-escalation, defense-evasion",Windows,2,2,0,Medium,44.6,"APT38, Cobalt Group","APT38, Cobalt Group",,False,,NO,Primarily local host-based operations,
T1573.001,Symmetric Cryptography,Adversaries may employ a known symmetric encryption algorithm to conceal command and control traffic rather than relying on any inherent protections provided by a communication protocol. Symmetric encryption algorithms use the same key for plaintext encryption and ciphertext decryption. Common symme...,command-and-control,"ESXi, Linux, macOS, Network Devices, Windows",5,1,4,Common,41.4,"Carbanak, Dridex, Lazarus Group, QakBot, TrickBot",Lazarus Group,"Carbanak, Dridex, QakBot, TrickBot",False,,PARTIAL,May involve network communication based on implementation,Protocol-specific traffic if network variant used
T1047,Windows Management Instrumentation,Adversaries may abuse Windows Management Instrumentation (WMI) to execute malicious commands and payloads. WMI is designed for programmers and is the infrastructure for management data and operations on Windows systems.(Citation: WMI 1-3) WMI is an administration feature that provides a uniform envi...,execution,Windows,4,3,1,Common,41.4,"Indrik Spider, Lazarus Group, QakBot, Wizard Spider","Indrik Spider, Lazarus Group, Wizard Spider",QakBot,False,,NO,Primarily local host-based operations,
T1574.001,DLL,"Adversaries may abuse dynamic-link library files (DLLs) in order to achieve persistence, escalate privileges, and evade defenses. DLLs are libraries that contain code and data that can be simultaneously utilized by multiple programs. While DLLs are not malicious by nature, they can be abused through...","persistence, privilege-escalation, defense-evasion",Windows,3,1,2,Medium,40.87,"Dridex, Lazarus Group, QakBot",Lazarus Group,"Dridex, QakBot",False,,NO,Primarily local host-based operations,
T1041,Exfiltration Over C2 Channel,Adversaries may steal data by exfiltrating it over an existing command and control channel. Stolen data is encoded into the normal communications channel using the same protocol as command and control communications.,exfiltration,"ESXi, Linux, macOS, Windows",6,2,4,High-Priority,40.4,"Carberp, Dyre, Lazarus Group, QakBot, TrickBot, Wizard Spider","Lazarus Group, Wizard Spider","Carberp, Dyre, QakBot, TrickBot",False,,YES,Data exfiltration over C2 channel,"Encrypted outbound traffic, large data volumes"
T1090.002,External Proxy,"Adversaries may use an external proxy to act as an intermediary for network communications to a command and control server to avoid direct connections to their infrastructure. Many tools exist that enable traffic redirection through proxies or port redirection, including [HTRAN](https://attack.mitre...",command-and-control,"ESXi, Linux, Network Devices, Windows, macOS",4,2,2,Common,40.4,"Lazarus Group, QakBot, Silence, TrickBot","Lazarus Group, Silence","QakBot, TrickBot",False,,PARTIAL,May involve network communication based on implementation,Protocol-specific traffic if network variant used
T1219,Remote Access Tools,"An adversary may use legitimate remote access tools to establish an interactive command and control channel within a network. Remote access tools create a session between two trusted hosts through a graphical interface, a command line interaction, a protocol tunnel via development or management soft...",command-and-control,"Linux, macOS, Windows",4,2,3,Common,40.4,"Carbanak, Cobalt Group, Dridex, TrickBot","Carbanak, Cobalt Group","Carbanak, Dridex, TrickBot",False,,YES,Remote access software usage,"TeamViewer, VNC, AnyDesk network traffic"
T1497.003,Time Based Checks,"Adversaries may employ various time-based methods to detect virtualization and analysis environments, particularly those that attempt to manipulate time mechanisms to simulate longer elapses of time. This may include enumerating time-based properties, such as uptime or the system clock. 

Adversarie...","defense-evasion, discovery","Linux, macOS, Windows",2,0,2,Medium,39.4,"QakBot, TrickBot",,"QakBot, TrickBot",False,,NO,Primarily local host-based operations,
T1497.001,System Checks,"Adversaries may employ various system checks to detect and avoid virtualization and analysis environments. This may include changing behaviors based on the results of checks for the presence of artifacts indicative of a virtual machine environment (VME) or sandbox. If the adversary detects a VME, th...","defense-evasion, discovery","Linux, macOS, Windows",2,0,2,Medium,39.4,"Dyre, QakBot",,"Dyre, QakBot",False,,NO,Primarily local host-based operations,
T1003.001,LSASS Memory,"Adversaries may attempt to access credential material stored in the process memory of the Local Security Authority Subsystem Service (LSASS). After a user logs on, the system generates and stores a variety of credential materials in LSASS process memory. These credential materials can be harvested b...",credential-access,Windows,3,3,0,Medium,38.8,"Indrik Spider, Silence, Wizard Spider","Indrik Spider, Silence, Wizard Spider",,False,,NO,Primarily local host-based operations,
T1056.001,Keylogging,"Adversaries may log user keystrokes to intercept credentials as the user types them. Keylogging is likely to be used to acquire credentials for new access opportunities when [OS Credential Dumping](https://attack.mitre.org/techniques/T1003) efforts are not effective, and may require an adversary to ...","collection, credential-access","Linux, macOS, Network Devices, Windows",4,2,2,Common,38.6,"APT38, Carbanak, Lazarus Group, QakBot","APT38, Lazarus Group","Carbanak, QakBot",False,,PARTIAL,May involve network communication based on implementation,Protocol-specific traffic if network variant used
T1007,System Service Discovery,"Adversaries may try to gather information about registered local system services. Adversaries may obtain information about services using tools as well as OS utility commands such as <code>sc query</code>, <code>tasklist /svc</code>, <code>systemctl --type=service</code>, and <code>net start</code>....",discovery,"Linux, macOS, Windows",3,1,2,Medium,37.8,"Dyre, Indrik Spider, TrickBot",Indrik Spider,"Dyre, TrickBot",False,,NO,Primarily local host-based operations,
T1046,Network Service Discovery,"Adversaries may attempt to get a listing of services running on remote hosts and local network infrastructure devices, including those that may be vulnerable to remote software exploitation. Common methods to acquire this information include port, vulnerability, and/or wordlist scans using tools tha...",discovery,"Containers, IaaS, Linux, macOS, Network Devices, Windows",2,2,0,Medium,36.8,"Cobalt Group, Lazarus Group","Cobalt Group, Lazarus Group",,False,,YES,Network port and service scanning,"SYN scans, service probes, port sweep traffic"
